{
  "created_at": "2026-07-21T08:00:00Z",
  "entries": [
    {
      "notes": "product name",
      "pronunciation": "/tʃwɛn/",
      "schema_version": "1",
      "surface": "Qwen"
    },
    {
      "notes": null,
      "pronunciation": "/ˈloʊ.rə/",
      "schema_version": "1",
      "surface": "LoRA"
    }
  ],
  "id": "01J2ZK3AC9V6XW8YQ4R5T6U7TTS2",
  "language": "en-US",
  "provider_tier": "CLOUD_HIGH_QUALITY",
  "schema_version": "1",
  "version": 1
}
